{
  "stage": "PREMIUM_WEB_REDESIGN_PLAN",
  "status": "passed",
  "run_id": "commercial-payment-2026-04-23-203843-leadfill-v0-2-0-b846c2",
  "product_key": "leadfill-one-profile",
  "generated_at": "2026-04-24T04:32:37.429Z",
  "source_run_id": "commercial-payment-2026-04-23-203843-leadfill-v0-2-0-b846c2",
  "current_primary_environment": "california",
  "payment_mode": "test",
  "production_payment_status": "not_verified",
  "objectives": [
    "Make LeadFill look like a maintained commercial Chrome extension product.",
    "Clarify the one-profile value proposition within the first viewport.",
    "Make Free vs Lifetime pricing obvious without adding extra plans.",
    "Keep local-only, no upload, and no cloud sync trust language prominent.",
    "Explain that paid access comes from webhook-confirmed entitlement, not successUrl."
  ],
  "redesigned_pages": [
    "LeadFill product-first homepage",
    "Dedicated product detail page",
    "Pricing and checkout guidance page",
    "Account and membership page",
    "Refund, privacy, and terms pages",
    "Checkout success guidance page",
    "Checkout cancelled / failed guidance page",
    "Product catalog index",
    "Localized site variants for zh-cn, ja, and es"
  ],
  "information_architecture": [
    "Hero with product name, value proposition, free tier, lifetime price, and trust notes.",
    "Navigation centered on Home, Product, Pricing, and Account.",
    "Core benefits limited to a small set of stronger sales points.",
    "How it works as a four-step flow with real screenshots.",
    "Feature breakdown tied to implemented field behavior on a separate product page.",
    "Two-plan pricing only: Free and Lifetime.",
    "Payment safety and membership guidance moved into pricing, account, and checkout pages.",
    "Refund, privacy, and terms moved to footer-level legal pages."
  ],
  "generated_files": [
    "index.html",
    "product.html",
    "pricing.html",
    "account.html",
    "checkout/success.html",
    "checkout/cancel.html",
    "entitlement.html",
    "refund.html",
    "privacy.html",
    "terms.html",
    "styles.css",
    "locales.json",
    "zh-cn/index.html",
    "zh-cn/product.html",
    "zh-cn/pricing.html",
    "zh-cn/account.html",
    "zh-cn/refund.html",
    "zh-cn/privacy.html",
    "zh-cn/terms.html",
    "zh-cn/checkout/success.html",
    "zh-cn/checkout/cancel.html",
    "ja/index.html",
    "ja/product.html",
    "ja/pricing.html",
    "ja/account.html",
    "ja/refund.html",
    "ja/privacy.html",
    "ja/terms.html",
    "ja/checkout/success.html",
    "ja/checkout/cancel.html",
    "es/index.html",
    "es/product.html",
    "es/pricing.html",
    "es/account.html",
    "es/refund.html",
    "es/privacy.html",
    "es/terms.html",
    "es/checkout/success.html",
    "es/checkout/cancel.html",
    "product.json",
    "checkout_config.json",
    "README.md",
    "hwh_product_config_checklist.md"
  ],
  "non_goals_preserved": [
    "No Chrome upload.",
    "No Chrome publish.",
    "No production payment.",
    "No Google login.",
    "No backend payment logic change.",
    "No unimplemented feature claims."
  ],
  "next_step": "human_visual_review",
  "redaction_checks": {
    "sanitized_response_bodies": true,
    "checked_secret_value_count": 1,
    "secret_values_present_in_artifact": false,
    "authorization_header_pattern_present": false,
    "key_material_pattern_present": false,
    "secret_marker_pattern_present": false,
    "redaction_guard_triggered": false
  }
}
