{
  "stage": "PREMIUM_WEB_REDESIGN_PLAN",
  "status": "passed",
  "run_id": "commercial-payment-2026-04-23-203843-leadfill-v0-2-0-b846c2",
  "product_key": "leadfill-one-profile",
  "generated_at": "2026-04-23T13:07:47.623Z",
  "source_run_id": "commercial-payment-2026-04-23-203843-leadfill-v0-2-0-b846c2",
  "current_primary_environment": "california",
  "payment_mode": "test",
  "production_payment_status": "not_verified",
  "objectives": [
    "Make LeadFill look like a maintained commercial Chrome extension product.",
    "Clarify the one-profile value proposition within the first viewport.",
    "Make Free vs Lifetime pricing obvious without adding extra plans.",
    "Keep local-only, no upload, and no cloud sync trust language prominent.",
    "Explain that paid access comes from webhook-confirmed entitlement, not successUrl."
  ],
  "redesigned_pages": [
    "Product homepage / LeadFill detail page",
    "Pricing and checkout guidance page",
    "Checkout success guidance page",
    "Checkout cancelled / failed guidance page",
    "Entitlement and membership guidance page",
    "Product catalog index"
  ],
  "information_architecture": [
    "Hero with product name, value proposition, price, free tier, trust notes, and CTA.",
    "Core benefits limited to four strong claims.",
    "How it works as a four-step flow.",
    "Feature breakdown tied to implemented field behavior.",
    "Two-plan pricing only: Free and Lifetime.",
    "Payment safety and entitlement guidance.",
    "FAQ and support/privacy/changelog sections."
  ],
  "generated_files": [
    "index.html",
    "pricing.html",
    "checkout/success.html",
    "checkout/cancel.html",
    "entitlement.html",
    "styles.css",
    "product.json",
    "checkout_config.json",
    "README.md",
    "hwh_product_config_checklist.md"
  ],
  "non_goals_preserved": [
    "No Chrome upload.",
    "No Chrome publish.",
    "No production payment.",
    "No Google login.",
    "No backend payment logic change.",
    "No unimplemented feature claims."
  ],
  "next_step": "human_visual_review",
  "redaction_checks": {
    "sanitized_response_bodies": true,
    "checked_secret_value_count": 1,
    "secret_values_present_in_artifact": false,
    "authorization_header_pattern_present": false,
    "key_material_pattern_present": false,
    "secret_marker_pattern_present": false,
    "redaction_guard_triggered": false
  }
}
